{"document_kind":"scan-report","schema_version":3,"root":{"encoding":"utf8","data":"/"},"display_root":"/","state":"exact","accounting":{"headline":"identity-unique-allocated-bytes","hard_links_deduplicated":true,"shared_extents_deduplicated":false,"directory_metadata_included":false},"summary":{"scanned_entries":0,"identified_entries":0,"unreadable_entries":0,"unscanned_entries":0,"excluded_entries":0,"filesystem_boundaries":0,"link_entries":0,"deleted_entries":0,"deletion_changed_entries":0,"deletion_missing_entries":0,"deletion_failed_entries":0,"deletion_unattempted_entries":0,"scan_store_bytes":0,"scan_store_limit_bytes":0,"last_unreadable_path":null,"last_unscanned_path":null,"last_unscanned_reason":null,"last_worker_error":null},"entries":[]}